{
  "$schema": "https://json-schema.org/draft/2020-12/schema",
  "$id": "https://github.com/suzukiosm/vb6-archaeology/schema/archaeology.config.schema.json",
  "title": "vb6-archaeology kit configuration",
  "description": "Protected source trees, output directories and analysis hints. Validate with `python -m tools config-check`.",
  "type": "object",
  "additionalProperties": false,
  "required": ["protected_source_dirs"],
  "properties": {
    "$schema": {
      "type": "string",
      "description": "Relative path to this schema, for editor validation."
    },
    "protected_source_dirs": {
      "type": "array",
      "description": "In-repo directory names holding immutable VB6 originals. Hooks deny writes into them. Empty is valid when the originals live outside the repo (use protected_path_markers).",
      "items": { "type": "string", "minLength": 1 }
    },
    "protected_path_markers": {
      "type": "array",
      "description": "Path segments that are read-only wherever they appear, including outside the repo (e.g. an originals folder on a share).",
      "items": { "type": "string", "minLength": 1 }
    },
    "default_source_dir": {
      "type": "string",
      "description": "In-repo directory searched first when a tool needs the originals. Empty when the originals live outside the repo."
    },
    "extracts_dir": {
      "type": "string",
      "minLength": 1,
      "description": "Where extract writes analysis copies (default working/extracts)."
    },
    "default_extract": {
      "type": "string",
      "description": "Extract folder name used when --extract is omitted and several exist. Empty means require an explicit choice."
    },
    "reports_dir": {
      "type": "string",
      "minLength": 1,
      "description": "Where reports are written (default working/reports)."
    },
    "skeletons_dir": {
      "type": "string",
      "minLength": 1,
      "description": "Where form skeleton JSON is written (consumers may point this at a web lib dir)."
    },
    "readable_dir": {
      "type": "string",
      "minLength": 1,
      "description": "UTF-8 sidecar of an extract for Cursor Read (default working/readable). Not the analysis canon."
    },
    "index_dir": {
      "type": "string",
      "minLength": 1,
      "description": "Where `python -m tools index` writes the AI index (manifest + JSONL per extract; default working/index)."
    },
    "encoding": {
      "type": "string",
      "minLength": 1,
      "description": "Primary VB6 source encoding (cp932 for Japanese projects)."
    },
    "encoding_fallbacks": {
      "type": "array",
      "description": "Encodings tried when the primary decode fails.",
      "items": { "type": "string", "minLength": 1 }
    },
    "reports_http_port": {
      "type": "integer",
      "minimum": 1,
      "maximum": 65535,
      "description": "Loopback port used by `python -m tools serve`."
    },
    "scan_roots": {
      "type": "array",
      "description": "Directories scan-chars walks by default.",
      "items": { "type": "string", "minLength": 1 }
    },
    "scan_skip_dirs": {
      "type": "array",
      "description": "Directory names scan-chars never descends into. Protected dirs and markers are skipped automatically on top of this list.",
      "items": { "type": "string", "minLength": 1 }
    },
    "mdi_defaults": {
      "type": "object",
      "description": "Consumer-only: MDI window and Picture1 heights emitted as mdiDefaults in runtime-layout.json. Empty means the key is left out.",
      "additionalProperties": false,
      "properties": {
        "left": { "type": "integer" },
        "height": { "type": "integer" },
        "picture1HeightExpanded": { "type": "integer" },
        "picture1HeightCollapsed": { "type": "integer" }
      }
    },
    "mdi_chrome": {
      "type": "object",
      "description": "Consumer-only: MDI shell VB_Name(s) and chrome control names for runtime_layout. Kit default is empty — set shell_forms/control_names in the consumer config (common example: MDIForm1 + Picture1/FG1/fg2).",
      "additionalProperties": false,
      "properties": {
        "shell_forms": {
          "type": "array",
          "description": "MDI shell form VB_Name(s). Empty = no shell-name chrome attribution.",
          "items": { "type": "string", "minLength": 1 }
        },
        "control_names": {
          "type": "array",
          "description": "Controls treated as MDI chrome (matched case-insensitively as path segments). Empty = no control-name chrome.",
          "items": { "type": "string", "minLength": 1 }
        }
      }
    },
    "geometry_hints": {
      "type": "object",
      "description": "FormName -> twips box, used when resolving parent-relative runtime expressions.",
      "additionalProperties": {
        "type": "object",
        "additionalProperties": false,
        "properties": {
          "left": { "type": "integer" },
          "top": { "type": "integer" },
          "width": { "type": "integer" },
          "height": { "type": "integer" }
        }
      }
    },
    "deep_read_name_map": {
      "type": "object",
      "description": "VB_Name -> output key override for deep-read (empty means lowercase VB_Name).",
      "additionalProperties": { "type": "string", "minLength": 1 }
    },
    "layout_sub_scores": {
      "type": "object",
      "description": "Lowercase Sub name -> open-path score for layout. Keep app-specific openers in the consumer config.",
      "additionalProperties": { "type": "integer" }
    },
    "picture1_height_by_sub": {
      "type": "object",
      "description": "Consumer-only: lowercase Sub -> Form VB_Name for Picture1.Height attribution.",
      "additionalProperties": { "type": "string", "minLength": 1 }
    },
    "verify_report_allow_files": {
      "type": "array",
      "description": "Consumer-only: basenames verify-names accepts beyond the inventory.",
      "items": { "type": "string", "minLength": 1 }
    },
    "optional_assign_markers": {
      "type": "array",
      "description": "Consumer-specific assignment markers scanned by deep-read (e.g. PARA). Kit default is empty — not a required business key.",
      "items": { "type": "string", "minLength": 1 }
    },
    "notes": {
      "type": "object",
      "description": "Free-form human notes kept next to the settings they explain.",
      "additionalProperties": { "type": "string" }
    }
  }
}
